{"actionCounts":{"REMOVE":0,"RETRACT":0,"UPSERT":2},"exportId":"fe807c25-6520-434a-a770-50ca75a13af2","generatedAt":"2026-10-13T08:22:44.855735Z","itemCount":2,"items":[{"action":"UPSERT","artifactBytes":1716,"artifactPath":"stories/tr/abd-dogal-gaz-cikarimi-temmuz-2026-rekor.json","artifactSha256":"f2ea0b01e40f0f133f0c71365a9e510e9b25a8e837c098480edf59baea64a2cc","removalProof":null,"removalReceiptSha256":null,"revisionContentHash":"46c34c96d64a738dbd6d6d3770dcaf9ff29bd6c51185a728fb08e09f450c52fb","revisionId":"3dee1118-da21-4200-b49b-dc295422fa68","revisionNumber":1,"slug":"abd-dogal-gaz-cikarimi-temmuz-2026-rekor","storyId":"ea62dd3e-2f7f-40e6-8feb-de0d61cc973b"},{"action":"UPSERT","artifactBytes":1905,"artifactPath":"stories/tr/eia-abd-kis-isinma-giderleri-2026-2027.json","artifactSha256":"ba7ecb6a0c267b808327c4e9f228f19cab4c3da6735a8819254847e246051685","removalProof":null,"removalReceiptSha256":null,"revisionContentHash":"a16436958b2b9f9bd2b3e6c30d0e409f0ec43f0da1b20555648b2062d2df6a35","revisionId":"e3e753e4-38e3-4e3b-b7e5-08168d3178ab","revisionNumber":1,"slug":"eia-abd-kis-isinma-giderleri-2026-2027","storyId":"8c3a02a8-6b13-4e5f-8f6c-73fe612bcbd2"}],"runType":"FULL","schemaVersion":2,"target":"GITHUB_PAGES"}
