{"actionCounts":{"REMOVE":0,"RETRACT":1,"UPSERT":12},"exportId":"7249ad7c-52d1-436e-aa2e-5dd12251a00d","generatedAt":"2026-10-26T13:11:28.219844Z","itemCount":13,"items":[{"action":"UPSERT","artifactBytes":1716,"artifactPath":"stories/tr/abd-dogal-gaz-cikarimi-temmuz-2026-rekor.json","artifactSha256":"f2ea0b01e40f0f133f0c71365a9e510e9b25a8e837c098480edf59baea64a2cc","removalProof":null,"removalReceiptSha256":null,"revisionContentHash":"46c34c96d64a738dbd6d6d3770dcaf9ff29bd6c51185a728fb08e09f450c52fb","revisionId":"3dee1118-da21-4200-b49b-dc295422fa68","revisionNumber":1,"slug":"abd-dogal-gaz-cikarimi-temmuz-2026-rekor","storyId":"ea62dd3e-2f7f-40e6-8feb-de0d61cc973b"},{"action":"UPSERT","artifactBytes":1647,"artifactPath":"stories/tr/corpus-christi-lng-terminalinde-ucuncu-asama-tamamlandi.json","artifactSha256":"7f10c16e306d5e389077e22753fb73c4747e6e37c25edb5f16b6a13b3d80a3c9","removalProof":null,"removalReceiptSha256":null,"revisionContentHash":"2cda4f5c4c8dd5c1d7158b55b55fee726cefa57208816eb1b89a2c3ad5b80426","revisionId":"45dec079-cdfe-4dd4-99d8-7b0e376e805a","revisionNumber":1,"slug":"corpus-christi-lng-terminalinde-ucuncu-asama-tamamlandi","storyId":"88de0092-8432-4bf4-86a7-d736ee1ac272"},{"action":"UPSERT","artifactBytes":1905,"artifactPath":"stories/tr/eia-abd-kis-isinma-giderleri-2026-2027.json","artifactSha256":"ba7ecb6a0c267b808327c4e9f228f19cab4c3da6735a8819254847e246051685","removalProof":null,"removalReceiptSha256":null,"revisionContentHash":"a16436958b2b9f9bd2b3e6c30d0e409f0ec43f0da1b20555648b2062d2df6a35","revisionId":"e3e753e4-38e3-4e3b-b7e5-08168d3178ab","revisionNumber":1,"slug":"eia-abd-kis-isinma-giderleri-2026-2027","storyId":"8c3a02a8-6b13-4e5f-8f6c-73fe612bcbd2"},{"action":"UPSERT","artifactBytes":2536,"artifactPath":"stories/tr/epdk-2027-yekdem-basvurulari-icin-30-kasim-2026-tarihine-kadar-sure-tanidi.json","artifactSha256":"a305852562b27abec2f52f3657e5da943ad4b48c3e4e819fe438e82be50090ca","removalProof":null,"removalReceiptSha256":null,"revisionContentHash":"04398c0f747c014561333cae19ca62ea43d1d7344dbd98ac875269f2feb586fe","revisionId":"9141a130-0c90-4d12-a040-6a377091952d","revisionNumber":1,"slug":"epdk-2027-yekdem-basvurulari-icin-30-kasim-2026-tarihine-kadar-sure-tanidi","storyId":"bf0559af-22fa-42b3-a198-26d83e728e6f"},{"action":"UPSERT","artifactBytes":1978,"artifactPath":"stories/tr/epdk-tuketicilerin-ayni-olcum-noktasinda-depolama-tesisi-kurmasini-mumkun-kildi.json","artifactSha256":"8a55de6bc903ffb6ef1ba98cdb426f037cac0be59caaf1a988f684a83846dc6c","removalProof":null,"removalReceiptSha256":null,"revisionContentHash":"432c1ddd8a6adeb6f50f0ee343ec0fb675a10995cdd73b3148e525b8e670c38f","revisionId":"9f70c955-44d7-41ec-9e88-02ca208e00b2","revisionNumber":1,"slug":"epdk-tuketicilerin-ayni-olcum-noktasinda-depolama-tesisi-kurmasini-mumkun-kildi","storyId":"70ed99a0-b412-44e2-97ae-ef046b87a563"},{"action":"UPSERT","artifactBytes":1716,"artifactPath":"stories/tr/haber-aa080d3c-020e-4056-9641-72e8dd61f9cf.json","artifactSha256":"b65b764214ec5b99a0804f4ffa76ed3811d93300a37a54e791433f790e5e20aa","removalProof":null,"removalReceiptSha256":null,"revisionContentHash":"482e7a5b54a5f8b44beb58d840871cc9bfd31838386e3a7cb22f0e7f4b970ee8","revisionId":"afcf55f0-d42a-4d39-a185-450ba059a728","revisionNumber":1,"slug":"haber-aa080d3c-020e-4056-9641-72e8dd61f9cf","storyId":"e5acd1f8-0ffb-4afc-b6f3-7ce61c89db82"},{"action":"UPSERT","artifactBytes":1975,"artifactPath":"stories/tr/iklim-degisikligi-baskani-hasar-mevcut-politikalarin-devami-halinde-3-c-artis.json","artifactSha256":"0c21b560e8554b263ca13b7b9a1ecc80dbdff3acd7be2e27e71ec5e0ec41b933","removalProof":null,"removalReceiptSha256":null,"revisionContentHash":"9f831fd4157b95d6f038033392d36d52a0896960179728002b38f28b5e537f92","revisionId":"255d0415-ef84-4fb7-af9b-50579503bf41","revisionNumber":1,"slug":"iklim-degisikligi-baskani-hasar-mevcut-politikalarin-devami-halinde-3-c-artis","storyId":"601dd296-1130-4ee7-bc05-d8c6c23684a4"},{"action":"UPSERT","artifactBytes":1260,"artifactPath":"stories/tr/kasim-ayi-spot-gaz-kapasitesi-icin-talep-toplama-23-ekimde.json","artifactSha256":"c1be8ed7cd0f13d2a71040b30a5541ee85016dc44af3c9899ae49e41b4e5c3dc","removalProof":null,"removalReceiptSha256":null,"revisionContentHash":"e2093cfafe13927d74e1acdc0cee1cfcbd82606da90952193caf63b8aae761e2","revisionId":"7a7f9664-28f8-4729-bb1f-ca36cf430d6a","revisionNumber":1,"slug":"kasim-ayi-spot-gaz-kapasitesi-icin-talep-toplama-23-ekimde","storyId":"feb0bc8b-9e9b-4c98-b49d-8d155e4d205e"},{"action":"RETRACT","artifactBytes":855,"artifactPath":"stories/tr/osman-gazi-yuzer-uretim-platformu-karadenizde-gorevine-basladi.json","artifactSha256":"a0bfe414e75735d8c6ace27f5be8aac012a99ef694a112c2923e78664ac6b874","removalProof":null,"removalReceiptSha256":null,"revisionContentHash":"962dd8df25baab58fbb491b60e98966dab7871dd0f0c29362722fd78efcf73b2","revisionId":"c6cb3c14-c0e0-4685-9a22-05298d3cd807","revisionNumber":2,"slug":"osman-gazi-yuzer-uretim-platformu-karadenizde-gorevine-basladi","storyId":"3731928e-c9ac-4d93-b1ab-1c7cd5410906"},{"action":"UPSERT","artifactBytes":2419,"artifactPath":"stories/tr/petkim-yeni-etilen-polipropilen-ve-polietilen-tesisleri-icin-lisans-ve.json","artifactSha256":"72e885dde3c9f3adf278bbf3a33faf77ed42f1554951823508d633e04cc669a9","removalProof":null,"removalReceiptSha256":null,"revisionContentHash":"f387201d8ef5d5f9e427004477bd7a4ef24b13f49c743767fae4b62e2612fff1","revisionId":"f092d5d8-361f-41e6-a107-f645c679dda6","revisionNumber":1,"slug":"petkim-yeni-etilen-polipropilen-ve-polietilen-tesisleri-icin-lisans-ve","storyId":"411b4d3b-4d69-4164-b066-b576f421399e"},{"action":"UPSERT","artifactBytes":1719,"artifactPath":"stories/tr/petrol-ofisi-fortune-500-turkiye-2025-listesinde-7-sirada.json","artifactSha256":"749b8f8112aaccff188b9bedf8f117e55664c0c1262681722b974f506899b0e3","removalProof":null,"removalReceiptSha256":null,"revisionContentHash":"3e1a80a73d22eb1695d8660e84834f37ed4ec43afe190d13c2f6b430c4310067","revisionId":"c1f455f0-2c5e-4922-80ff-372e68a1c67f","revisionNumber":1,"slug":"petrol-ofisi-fortune-500-turkiye-2025-listesinde-7-sirada","storyId":"e342ed82-1fb9-43cd-8659-0f40c1426fcc"},{"action":"UPSERT","artifactBytes":2283,"artifactPath":"stories/tr/turkiye-de-sarj-soketi-sayisi-eylulde-48-971-e-cikti.json","artifactSha256":"de7e3a6ae18deadbbf8e800c5a4e5322b176852a5743e24f488f42e3bd15ce36","removalProof":null,"removalReceiptSha256":null,"revisionContentHash":"1c68383a8f1e8a72c6c3a810ae79b234ac40bbb9f2bb0798eaed5dbdda8014c8","revisionId":"941610c1-14ad-47ae-8652-3915fb3b819a","revisionNumber":1,"slug":"turkiye-de-sarj-soketi-sayisi-eylulde-48-971-e-cikti","storyId":"81950f02-de0e-44a0-9f6f-613fc67474c1"},{"action":"UPSERT","artifactBytes":1809,"artifactPath":"stories/tr/turkiyenin-elektrik-kurulu-gucu-eylul-sonunda-127355-mwa-ulasti.json","artifactSha256":"ddd4d8123cc093824340556470e5ac4740549d989d08c520bd589d639b17f92d","removalProof":null,"removalReceiptSha256":null,"revisionContentHash":"e1c95f973743603676fd563f9af81eb2bf5ef363f790e28949e2c0bc29763fb0","revisionId":"020d4041-1d4f-49fd-96cc-fca657c89615","revisionNumber":2,"slug":"turkiyenin-elektrik-kurulu-gucu-eylul-sonunda-127355-mwa-ulasti","storyId":"665ca7be-7326-4bb5-914a-a1e8524267cf"}],"runType":"FULL","schemaVersion":2,"target":"GITHUB_PAGES"}
