{"actionCounts":{"REMOVE":0,"RETRACT":0,"UPSERT":5},"exportId":"13c85f68-4e98-40d4-b50f-2c5f412f6bff","generatedAt":"2026-10-20T09:54:41.941305Z","itemCount":5,"items":[{"action":"UPSERT","artifactBytes":1716,"artifactPath":"stories/tr/abd-dogal-gaz-cikarimi-temmuz-2026-rekor.json","artifactSha256":"f2ea0b01e40f0f133f0c71365a9e510e9b25a8e837c098480edf59baea64a2cc","removalProof":null,"removalReceiptSha256":null,"revisionContentHash":"46c34c96d64a738dbd6d6d3770dcaf9ff29bd6c51185a728fb08e09f450c52fb","revisionId":"3dee1118-da21-4200-b49b-dc295422fa68","revisionNumber":1,"slug":"abd-dogal-gaz-cikarimi-temmuz-2026-rekor","storyId":"ea62dd3e-2f7f-40e6-8feb-de0d61cc973b"},{"action":"UPSERT","artifactBytes":1905,"artifactPath":"stories/tr/eia-abd-kis-isinma-giderleri-2026-2027.json","artifactSha256":"ba7ecb6a0c267b808327c4e9f228f19cab4c3da6735a8819254847e246051685","removalProof":null,"removalReceiptSha256":null,"revisionContentHash":"a16436958b2b9f9bd2b3e6c30d0e409f0ec43f0da1b20555648b2062d2df6a35","revisionId":"e3e753e4-38e3-4e3b-b7e5-08168d3178ab","revisionNumber":1,"slug":"eia-abd-kis-isinma-giderleri-2026-2027","storyId":"8c3a02a8-6b13-4e5f-8f6c-73fe612bcbd2"},{"action":"UPSERT","artifactBytes":1716,"artifactPath":"stories/tr/haber-aa080d3c-020e-4056-9641-72e8dd61f9cf.json","artifactSha256":"b65b764214ec5b99a0804f4ffa76ed3811d93300a37a54e791433f790e5e20aa","removalProof":null,"removalReceiptSha256":null,"revisionContentHash":"482e7a5b54a5f8b44beb58d840871cc9bfd31838386e3a7cb22f0e7f4b970ee8","revisionId":"afcf55f0-d42a-4d39-a185-450ba059a728","revisionNumber":1,"slug":"haber-aa080d3c-020e-4056-9641-72e8dd61f9cf","storyId":"e5acd1f8-0ffb-4afc-b6f3-7ce61c89db82"},{"action":"UPSERT","artifactBytes":1260,"artifactPath":"stories/tr/kasim-ayi-spot-gaz-kapasitesi-icin-talep-toplama-23-ekimde.json","artifactSha256":"c1be8ed7cd0f13d2a71040b30a5541ee85016dc44af3c9899ae49e41b4e5c3dc","removalProof":null,"removalReceiptSha256":null,"revisionContentHash":"e2093cfafe13927d74e1acdc0cee1cfcbd82606da90952193caf63b8aae761e2","revisionId":"7a7f9664-28f8-4729-bb1f-ca36cf430d6a","revisionNumber":1,"slug":"kasim-ayi-spot-gaz-kapasitesi-icin-talep-toplama-23-ekimde","storyId":"feb0bc8b-9e9b-4c98-b49d-8d155e4d205e"},{"action":"UPSERT","artifactBytes":2283,"artifactPath":"stories/tr/turkiye-de-sarj-soketi-sayisi-eylulde-48-971-e-cikti.json","artifactSha256":"de7e3a6ae18deadbbf8e800c5a4e5322b176852a5743e24f488f42e3bd15ce36","removalProof":null,"removalReceiptSha256":null,"revisionContentHash":"1c68383a8f1e8a72c6c3a810ae79b234ac40bbb9f2bb0798eaed5dbdda8014c8","revisionId":"941610c1-14ad-47ae-8652-3915fb3b819a","revisionNumber":1,"slug":"turkiye-de-sarj-soketi-sayisi-eylulde-48-971-e-cikti","storyId":"81950f02-de0e-44a0-9f6f-613fc67474c1"}],"runType":"FULL","schemaVersion":2,"target":"GITHUB_PAGES"}
