{"actionCounts":{"REMOVE":0,"RETRACT":0,"UPSERT":3},"exportId":"6d102ed6-6c0a-4d44-b141-b6f3d1165df1","generatedAt":"2026-10-19T12:37:31.547683Z","itemCount":3,"items":[{"action":"UPSERT","artifactBytes":1716,"artifactPath":"stories/tr/abd-dogal-gaz-cikarimi-temmuz-2026-rekor.json","artifactSha256":"f2ea0b01e40f0f133f0c71365a9e510e9b25a8e837c098480edf59baea64a2cc","removalProof":null,"removalReceiptSha256":null,"revisionContentHash":"46c34c96d64a738dbd6d6d3770dcaf9ff29bd6c51185a728fb08e09f450c52fb","revisionId":"3dee1118-da21-4200-b49b-dc295422fa68","revisionNumber":1,"slug":"abd-dogal-gaz-cikarimi-temmuz-2026-rekor","storyId":"ea62dd3e-2f7f-40e6-8feb-de0d61cc973b"},{"action":"UPSERT","artifactBytes":1905,"artifactPath":"stories/tr/eia-abd-kis-isinma-giderleri-2026-2027.json","artifactSha256":"ba7ecb6a0c267b808327c4e9f228f19cab4c3da6735a8819254847e246051685","removalProof":null,"removalReceiptSha256":null,"revisionContentHash":"a16436958b2b9f9bd2b3e6c30d0e409f0ec43f0da1b20555648b2062d2df6a35","revisionId":"e3e753e4-38e3-4e3b-b7e5-08168d3178ab","revisionNumber":1,"slug":"eia-abd-kis-isinma-giderleri-2026-2027","storyId":"8c3a02a8-6b13-4e5f-8f6c-73fe612bcbd2"},{"action":"UPSERT","artifactBytes":2283,"artifactPath":"stories/tr/turkiye-de-sarj-soketi-sayisi-eylulde-48-971-e-cikti.json","artifactSha256":"de7e3a6ae18deadbbf8e800c5a4e5322b176852a5743e24f488f42e3bd15ce36","removalProof":null,"removalReceiptSha256":null,"revisionContentHash":"1c68383a8f1e8a72c6c3a810ae79b234ac40bbb9f2bb0798eaed5dbdda8014c8","revisionId":"941610c1-14ad-47ae-8652-3915fb3b819a","revisionNumber":1,"slug":"turkiye-de-sarj-soketi-sayisi-eylulde-48-971-e-cikti","storyId":"81950f02-de0e-44a0-9f6f-613fc67474c1"}],"runType":"FULL","schemaVersion":2,"target":"GITHUB_PAGES"}
