{"actionCounts":{"REMOVE":1,"RETRACT":0,"UPSERT":0},"exportId":"00000000-0000-0000-0000-000000009004","generatedAt":"2026-10-07T09:05:00Z","itemCount":1,"items":[{"action":"REMOVE","artifactBytes":null,"artifactPath":"stories/tr/sentetik-2.json","artifactSha256":null,"removalProof":{"contractVersion":2,"runId":"00000000-0000-0000-0000-000000009004","slug":"sentetik-2","storyId":"00000000-0000-0000-0000-000000000002","targetPath":"stories/tr/sentetik-2.json"},"removalReceiptSha256":"840dbdc8debf3c6e3a447ae28b2436e9590e3631c5c5a1f1fb7bbbf90a7fba79","revisionContentHash":null,"revisionId":null,"revisionNumber":null,"slug":"sentetik-2","storyId":"00000000-0000-0000-0000-000000000002"}],"runType":"INCREMENTAL","schemaVersion":2,"target":"GITHUB_PAGES"}
