{"actionCounts":{"REMOVE":0,"RETRACT":0,"UPSERT":1},"exportId":"00000000-0000-0000-0000-000000009001","generatedAt":"2026-10-07T09:01:00Z","itemCount":1,"items":[{"action":"UPSERT","artifactBytes":792,"artifactPath":"stories/tr/sentetik-1.json","artifactSha256":"4b42a9be40d53cc59aac7d6e4bba681560a1292ec9d959b60c1732b7d54d227b","removalProof":null,"removalReceiptSha256":null,"revisionContentHash":"4b6de69ce79db0758874e5f6a66e36d35787646966202b062c42c015c4b85159","revisionId":"00000000-0000-0000-0000-000000000101","revisionNumber":1,"slug":"sentetik-1","storyId":"00000000-0000-0000-0000-000000000001"}],"runType":"FULL","schemaVersion":2,"target":"GITHUB_PAGES"}
