{"actionCounts":{"REMOVE":0,"RETRACT":0,"UPSERT":1},"exportId":"f13d572b-bd11-4edd-b99f-4bb86343eea2","generatedAt":"2026-10-09T13:36:10.764898Z","itemCount":1,"items":[{"action":"UPSERT","artifactBytes":1905,"artifactPath":"stories/tr/eia-abd-kis-isinma-giderleri-2026-2027.json","artifactSha256":"ba7ecb6a0c267b808327c4e9f228f19cab4c3da6735a8819254847e246051685","removalProof":null,"removalReceiptSha256":null,"revisionContentHash":"a16436958b2b9f9bd2b3e6c30d0e409f0ec43f0da1b20555648b2062d2df6a35","revisionId":"e3e753e4-38e3-4e3b-b7e5-08168d3178ab","revisionNumber":1,"slug":"eia-abd-kis-isinma-giderleri-2026-2027","storyId":"8c3a02a8-6b13-4e5f-8f6c-73fe612bcbd2"}],"runType":"FULL","schemaVersion":2,"target":"GITHUB_PAGES"}
