{"actionCounts":{"REMOVE":0,"RETRACT":0,"UPSERT":1},"exportId":"00000000-0000-0000-0000-000000009002","generatedAt":"2026-10-07T09:02:00Z","itemCount":1,"items":[{"action":"UPSERT","artifactBytes":792,"artifactPath":"stories/tr/sentetik-2.json","artifactSha256":"b412c382e7ce8916db7e37ef34b8c42c71e1094e261a69e973948daa70a04c3a","removalProof":null,"removalReceiptSha256":null,"revisionContentHash":"5ff2e19e2b54c15aa3e390adfd1f2f3a67c20ff865f058474aba6421bebc1e50","revisionId":"00000000-0000-0000-0000-000000000201","revisionNumber":1,"slug":"sentetik-2","storyId":"00000000-0000-0000-0000-000000000002"}],"runType":"INCREMENTAL","schemaVersion":2,"target":"GITHUB_PAGES"}
