{"actionCounts":{"REMOVE":0,"RETRACT":1,"UPSERT":0},"exportId":"00000000-0000-0000-0000-000000009003","generatedAt":"2026-10-07T09:04:00Z","itemCount":1,"items":[{"action":"RETRACT","artifactBytes":725,"artifactPath":"stories/tr/sentetik-1.json","artifactSha256":"e449dca94c37370391a4279c922d5205eea830d717041d87a14f5d50de9960ac","removalProof":null,"removalReceiptSha256":null,"revisionContentHash":"962dd8df25baab58fbb491b60e98966dab7871dd0f0c29362722fd78efcf73b2","revisionId":"00000000-0000-0000-0000-000000000102","revisionNumber":2,"slug":"sentetik-1","storyId":"00000000-0000-0000-0000-000000000001"}],"runType":"INCREMENTAL","schemaVersion":2,"target":"GITHUB_PAGES"}
